{
  "schema_version": "1.0",
  "site": {
    "url": "https://example.com",
    "home_url": "https://example.com",
    "name": "Example Website"
  },
  "wordpress": {
    "version": "7.1",
    "multisite": false,
    "environment": "production"
  },
  "server": {
    "php_version": "8.3.12"
  },
  "agent": {
    "version": "1.0.0"
  },
  "timestamp": "2026-09-08T09:00:00Z"
}
